[
  {
    "cotacao-compra": 2814.0,
    "cotacao-venda": 2828.0,
    "data": "1984-12-03",
    "data-hora-fonte": "1984-12-03 11:29:00.0",
    "paridade-compra": 1.0,
    "paridade-venda": 1.0
  },
  {
    "cotacao-compra": 2867.0,
    "cotacao-venda": 2881.0,
    "data": "1984-12-04",
    "data-hora-fonte": "1984-12-04 11:17:00.0",
    "paridade-compra": 1.0,
    "paridade-venda": 1.0
  },
  {
    "cotacao-compra": 2908.0,
    "cotacao-venda": 2923.0,
    "data": "1984-12-05",
    "data-hora-fonte": "1984-12-05 18:50:00.0",
    "paridade-compra": 1.0,
    "paridade-venda": 1.0
  },
  {
    "cotacao-compra": 2908.0,
    "cotacao-venda": 2923.0,
    "data": "1984-12-06",
    "data-hora-fonte": "1984-12-06 16:30:00.0",
    "paridade-compra": 1.0,
    "paridade-venda": 1.0
  },
  {
    "cotacao-compra": 2908.0,
    "cotacao-venda": 2923.0,
    "data": "1984-12-07",
    "data-hora-fonte": "1984-12-07 16:04:00.0",
    "paridade-compra": 1.0,
    "paridade-venda": 1.0
  },
  {
    "cotacao-compra": 2950.0,
    "cotacao-venda": 2965.0,
    "data": "1984-12-10",
    "data-hora-fonte": "1984-12-10 17:13:00.0",
    "paridade-compra": 1.0,
    "paridade-venda": 1.0
  },
  {
    "cotacao-compra": 2950.0,
    "cotacao-venda": 2965.0,
    "data": "1984-12-11",
    "data-hora-fonte": "1984-12-11 17:11:00.0",
    "paridade-compra": 1.0,
    "paridade-venda": 1.0
  },
  {
    "cotacao-compra": 2950.0,
    "cotacao-venda": 2965.0,
    "data": "1984-12-12",
    "data-hora-fonte": "1984-12-12 16:17:00.0",
    "paridade-compra": 1.0,
    "paridade-venda": 1.0
  },
  {
    "cotacao-compra": 2950.0,
    "cotacao-venda": 2965.0,
    "data": "1984-12-13",
    "data-hora-fonte": "1984-12-13 18:05:00.0",
    "paridade-compra": 1.0,
    "paridade-venda": 1.0
  },
  {
    "cotacao-compra": 2993.0,
    "cotacao-venda": 3008.0,
    "data": "1984-12-14",
    "data-hora-fonte": "1984-12-14 16:29:00.0",
    "paridade-compra": 1.0,
    "paridade-venda": 1.0
  },
  {
    "cotacao-compra": 2993.0,
    "cotacao-venda": 3008.0,
    "data": "1984-12-17",
    "data-hora-fonte": "1984-12-17 17:08:00.0",
    "paridade-compra": 1.0,
    "paridade-venda": 1.0
  },
  {
    "cotacao-compra": 2993.0,
    "cotacao-venda": 3008.0,
    "data": "1984-12-18",
    "data-hora-fonte": "1984-12-18 16:47:00.0",
    "paridade-compra": 1.0,
    "paridade-venda": 1.0
  },
  {
    "cotacao-compra": 2993.0,
    "cotacao-venda": 3008.0,
    "data": "1984-12-19",
    "data-hora-fonte": "1984-12-19 16:42:00.0",
    "paridade-compra": 1.0,
    "paridade-venda": 1.0
  },
  {
    "cotacao-compra": 3041.0,
    "cotacao-venda": 3056.0,
    "data": "1984-12-20",
    "data-hora-fonte": "1984-12-20 16:56:00.0",
    "paridade-compra": 1.0,
    "paridade-venda": 1.0
  },
  {
    "cotacao-compra": 3041.0,
    "cotacao-venda": 3056.0,
    "data": "1984-12-21",
    "data-hora-fonte": "1984-12-21 16:18:00.0",
    "paridade-compra": 1.0,
    "paridade-venda": 1.0
  },
  {
    "cotacao-compra": 3041.0,
    "cotacao-venda": 3056.0,
    "data": "1984-12-24",
    "data-hora-fonte": "1984-12-24 10:52:00.0",
    "paridade-compra": 1.0,
    "paridade-venda": 1.0
  },
  {
    "cotacao-compra": 3091.0,
    "cotacao-venda": 3106.0,
    "data": "1984-12-26",
    "data-hora-fonte": "1984-12-26 16:11:00.0",
    "paridade-compra": 1.0,
    "paridade-venda": 1.0
  },
  {
    "cotacao-compra": 3091.0,
    "cotacao-venda": 3106.0,
    "data": "1984-12-27",
    "data-hora-fonte": "1984-12-27 16:20:00.0",
    "paridade-compra": 1.0,
    "paridade-venda": 1.0
  },
  {
    "cotacao-compra": 3168.0,
    "cotacao-venda": 3184.0,
    "data": "1984-12-28",
    "data-hora-fonte": "1984-12-28 16:35:00.0",
    "paridade-compra": 1.0,
    "paridade-venda": 1.0
  }
]
